1.81E+18,"Farah seems to respect Dr C like the Queen she's as she stood to greet her but she didn't stand to greet the other women.
#RHONairobi",,,,,,,,,,,,,,,,,,,,,,,,,,,,,,,,,,,,,,,,,
1.81E+18,"Next season brings classy women pr better yet bring back Sonel, Susan and Lisa Gosh😂😂😂 housewives please HOUSE FUCKEN WIVES not street fighters and baby soldiers! JEEEEZZZZ! #RHONairobi",,,,,,,,,,,,,,,,,,,,,,,,,,,,,,,,,,,,,,,,,
1.81E+18,"@oloriilaalaa God bless you,it’s how they are all hyping that woman’s vileness,she doesn’t support anybody,she doesn’t stick to dress code but wails when people don’t come out for her,very disgusting woman.I don’t even care for any of the women because they all get for body too #RHONairobi",,,,,,,,,,,,,,,,,,,,,,,,,,,,,,,,,,,,,,,,,
1.81E+18,"Dr C, gossiping and hammering on this women getting them pissed and play pretense settlement only to stir up shit isn’t a show, proud of my #RHOL ladies cause they know how to show up and how to spice up, bringing a coffin to a restaurant what in the heck of tackiness #RHONairobi",,,,,,,,,,,,,,,,,,,,,,,,,,,,,,,,,,,,,,,,,
1.81E+18,why is minne’s husband getting soo much screen time. he’s cute &amp; all but enough now #RHONairobi https://t.co/kT5VVIC04c,,,,,,,,,,,,,,,,,,,,,,,,,,,,,,,,,,,,,,,,,
1.81E+18,Minnie is a bully let me say Meaniii she’s mean and insecure . Body shames other women as well she cute but that behaviour is nasty and rotten #RHONairobi,,,,,,,,,,,,,,,,,,,,,,,,,,,,,,,,,,,,,,,,,
1.81E+18,Y’all need to give Dr. C a chair to rest because as much as she has her theatrics girl is carrying the show on her back!!!! Cut her a big fat cheque #RHONairobi https://t.co/GJkLA0L6aN,,,,,,,,,,,,,,,,,,,,,,,,,,,,,,,,,,,,,,,,,
1.81E+18,"All these other women should be as open as Dr C when it comes to what they do for a living 
#RHONairobi",,,,,,,,,,,,,,,,,,,,,,,,,,,,,,,,,,,,,,,,,
1.81E+18,"I'm sorry but, Only Dr C and Ferra are worth watching.

The rest of these girls are tired and washed up!!

Charles is more of a housewife than Minne

#RHONairobi",,,,,,,,,,,,,,,,,,,,,,,,,,,,,,,,,,,,,,,,,
1.81E+18,"I am tired, reality TV shows are becoming unbearable now. Every week we must watch grown women fight? They keep hosting parties and events but you already know they won't have fun but only fight. 
#RHONairobi",,,,,,,,,,,,,,,,,,,,,,,,,,,,,,,,,,,,,,,,,
1.81E+18,"@MPireBliss I told my sister the exact same thing..Zenah/Xenah is on something with Charles. Imma tell y'all right now a woman who has been a side chick/side baby mama/2nd wife claiming your husband as ""our husband"" is a huge problem and needs taking out immediately #RHONairobi #RHON https://t.co/6ZuGjfLd3g",,,,,,,,,,,,,,,,,,,,,,,,,,,,,,,,,,,,,,,,,
1.81E+18,"Not me looking for Zenah on instagram and leaving a nasty comment 😂😂 she really pissed me off. Tomorrow im fetching Minne im tired, someone needs to step in and check these girls!
#RHONairobi https://t.co/8OEzuC1apQ",,,,,,,,,,,,,,,,,,,,,,,,,,,,,,,,,,,,,,,,,
1.81E+18,At this stage Rajah is a nonsense person how could she attack Dr.C with her husband? That was very low of her and a proof that she's so unstable. 100%  mental case with her negative energy. She's a waste. #RhoNairobi #RhoNairobi,,,,,,,,,,,,,,,,,,,,,,,,,,,,,,,,,,,,,,,,,
1.81E+18,"Housewives thinking being late to events is cute is actually not. 
Really you can't be that vain to think your looks are so important, you can't honor time. People make provision for your presence and you won't even eat or immense yourself in the event. 
#RHONairobi",,,,,,,,,,,,,,,,,,,,,,,,,,,,,,,,,,,,,,,,,
1.81E+18,"I love the relationship Minnie and her husband Charles have you can tell they are each other's best friend. That man loves his wife. 😍😍😍
#RHONairobi",,,,,,,,,,,,,,,,,,,,,,,,,,,,,,,,,,,,,,,,,
1.81E+18,"So all these grown women a forming a group to bully another woman. Farah has been nothing but nice to these ladies and they return the gestures by showing her their ass. They are all disgusting.
#RHONairobi",,,,,,,,,,,,,,,,,,,,,,,,,,,,,,,,,,,,,,,,,
1.81E+18,Production needs to cut Charles a cheque.#RHONairobi,,,,,,,,,,,,,,,,,,,,,,,,,,,,,,,,,,,,,,,,,
1.81E+18,"Leaving the baby with Farah was so cute

#RHONairobi",,,,,,,,,,,,,,,,,,,,,,,,,,,,,,,,,,,,,,,,,
1.81E+18,"What’s this switch up from Dr. C towards Farah? I’ll actually appreciate it if my friend took me to a Gin making class because I’m launching a Gin line. 

Are these women okay? 

#RHONairobi",,,,,,,,,,,,,,,,,,,,,,,,,,,,,,,,,,,,,,,,,
,,,,,,,,,,,,,,,,,,,,,,,,,,,,,,,,,,,,,,,,,,
,,,,,,,,,,,,,,,,,,,,,,,,,,,,,,,,,,,,,,,,,,
131604000,"Of all the men in that house, it's Kellyrae that's really a husband material. He's really matured and full of wisdom. The rest are just for errands. Never seen Shaun in an intelligent conversation, it's so so sex talk with his village people chosen forbidden wife Wanni",,,,,,,,,,,,,,,,,,,,,,,,,,,,,,,,,,,,,,,,,
131230597,"Man, who selected this year’s housemates? That person really didn’t do a good job. Who are these two overweight women who are talking right now?",,,,,,,,,,,,,,,,,,,,,,,,,,,,,,,,,,,,,,,,,
131488763,"Giel, I heard that your girlfriend Chinwe was intimate with another man in the restroom. Can you confirm if this is true or not?",,,,,,,,,,,,,,,,,,,,,,,,,,,,,,,,,,,,,,,,,
131373735,"Why is kellyrae snubbing the wife or being too serious with the wife, even when she's trying to bring up a conversation. Wahala for besties",,,,,,,,,,,,,,,,,,,,,,,,,,,,,,,,,,,,,,,,,
1.81E+18,"Looks like Rejah just came with a lot of drama. Her husband is suing her &amp; the show as she filmed in his house with their kids without his consent. To his knowledge, she withdrew from the show after surgery only to find out she continued to film without his consent 🙆🏽‍♀️#RHONairobi https://t.co/jXHGNdYkky",,,,,,,,,,,,,,,,,,,,,,,,,,,,,,,,,,,,,,,,,
1.81E+18,Dr C seems like a powerful and influential someone in Nairobi. She has contacts and plugs people. I suspect that’s why Minnie and Vera will keep fighting or gossiping about her but never ever cut ties with her. They never burn the bridge #RHONairobi,,,,,,,,,,,,,,,,,,,,,,,,,,,,,,,,,,,,,,,,,
1.81E+18,These women all bluetoothed their hate for Dr C. I’m trying hard to think of what Dr C did to Rajah before the sniffing comments?? Child soldier comments are not that deep. She should have clarified and moved on .. #RHONairobi,,,,,,,,,,,,,,,,,,,,,,,,,,,,,,,,,,,,,,,,,
MIH-006,"No.. actually boys parents and boys are selfish that thy want the girl, her dowry her free service and everything but dint want or allow her to look afer her own parents .. uch selfish and greedy people..",,,,,,,,,,,,,,,,,,,,,,,,,,,,,,,,,,,,,,,,,
MIH-009,The thing which i just don't get at all is how do these people create amazinggg shaadis with all the trauma in hand??? Like really no fuck ups even when Karan is naked on the beach???,,,,,,,,,,,,,,,,,,,,,,,,,,,,,,,,,,,,,,,,,
MIH-018,Puja you understand the difference between enhancing someone’s facial features and changing someone’s skin tone? The latter happens because of societal prejudice towards dark skinned people and most Indians are dark. We are a self-hating people who still think white skin is superior. Please try to understand nuances.,,,,,,,,,,,,,,,,,,,,,,,,,,,,,,,,,,,,,,,,,