Comment ID,Comment Text,Does the comment mention specific media content? 0 = No 1 = Yes,- If Y: what content?,- If Y: what is the general attitude toward this media content? 1=Positive/2=Neutral/3=Negative/4=Mixed/5=Unclear,"- - If positive, what does the author like about this content? ","- - If negative, what does the author dislike about this content? ",Does the comment mention gender or gender roles? 0 = No 1 = Yes,- If Y: How would you characterize the gender roles? 1= Women do domestic/care work; 2=Women have limited economic freedom; 3= Women have limited leadership; 4=Women are in subservient roles; 5=Women do not discuss sex or reproductive health; 5=Men are sexual aggressors; 6=Men are leaders; 7=Men are violent; 8=Men are primary breadwinners,- If Y: name any other gender themes and topics addressed in the comment: ,- If Y: What is the general attitude expressed toward discussed gender norms? 1=Positive/2=Neutral/3=Negative/4=Mixed/5=Unclear ,- If Y: What is the general attitude expressed toward women? 1=Positive/2=Neutral/3=Negative/4=Mixed/5=Unclear  ,"- If Y: Does the comment use collective framing (“we,” “our society,” “everyone knows”) or individual framing (“I,” “my experience”) in discussing gender/gender roles? 1 = Collective, 2 = Individual, 3 = Can't tell/Does not apply","- If Y: Does the comment contest or reproduce cultural stereotypes around gender? 0 = Contest, 1 = Reproduce, 3 = Unclear/Neither","Does the comment mention race, ethnicity, nationality, tribe, language, or caste in relation to the media content ? 0 = No 1 = Yes","- If Y,  which? _____","- If Y: What is the general attitude expressed toward this race, ethnicity, nationality, tribe, caste, or language? 1=Positive/2=Neutral/3=Negative/4=Mixed/5=Unclear  ","Does the comment include any sexist or derogatory language? 0= No, 1= Yes","- If Y,  provide a quote","What emotions does the comment generally contain? 1=Contempt, 2=Anger,  3=Disgust, 4=Sadness, 5=Shame, 6=Embarrassment, 7=Guilt, 8=Compassion, 9=Pride, 10=No emotion","What emotions does the author express toward the media content? 1=Contempt, 2=Anger,  3=Disgust, 4=Sadness, 5=Shame, 6=Embarrassment, 7=Guilt, 8=Compassion, 9=Pride, 10=No emotion",Does the comment indicate that the author acquired new knowledge or information by watching?  0 = No I = Yes,- If Y: what did they learn?,Did the comment indicate that the author had existing knowledge reinforced by watching? 0 = No 1 = Yes,- If Y: what knowledge or information was reinforced?,Are there any calls to action in the comment (telling readers to do something)?  0 = No 1 = Yes,"- If Y, what is it calling readers to do?","Does the author share any information in the comment (e.g., share a fact, a link)? 0 = No 1 = Yes","- If Y, what information is shared?","Does the author advocate for anything in the comment (e.g., support a cause)? 0 = No 1 = Yes","- If Y, what do they advocate for?","Does the author correct any information in the comment (e.g., say that something is incorrect)? 0 = No 1 = Yes","- If Y, what do they correct?","Does the comment's author identify themselves in any way (name their gender, profession, location, etc)?  0 = No 1 = Yes","- If Y,  is profession mentioned?  0 = No 1 = Yes","- - If Y, what is the profession?","- If Y, is location mentioned?  0 = No 1 = Yes","- - If Y, what is the location?","- If Y, is race/ethnicity mentioned?  0 = No 1 = Yes","- - If Y, what is the location?","- If Y, is gender mentioned?  0 = No 1 = Yes","- - If Y, what gender?        1=Female, 2=Male, 3=Non-binary                                                                                                                                                                                                ",Notes
1.82E+18,"The moment I saw Zena with Cate as her bestie, I knew she is not a good person! Coz show me your friends, I tell who you are!!

Cate is that woman who was fighting for kelvin’s body and house!🤮🤮vile! Kenyans google her. Lynn Ngugi did a story too. #RHONairobi",I,Scence where Zena is with Cate,3,,Dislike of Cate and the fact that Zena was with her,0,,,,,,,0,,,0,,"2, 3","3, 4",I,Zena isn't a good person,0,,I,The author called Kenyans to google Cate,I,That Lynn Ngugi did a story on Cate,0,,I,,0,,,,,,,,,
1.81E+18,"Zena/Xenah, Minne, Vera, Rejah are the most disrespectful, ill-mannered, uncultured people on the entire Real Housewives Franchise. Here we are Kenyans getting pride for the progress we are making as a Nation  and these women's main contribution nikuaibisha Taifa #RHONairobi https://t.co/ngES9Bi3GA",0,,,,,0,,,,,,,0,,,0,,"2,3,6","2,3,6",0,,0,,0,,0,,0,,0,,0,,,,,,,,,
1.79E+18,"Polygamy #RHONairobi

Do you guys think Lisa's comment about African men and polygamy is racist. I feel like Minne is big at trying to be victim. Her husband was not mentioned and she was so triggered. It giving insecurity to me. Also the need to defend Kenyan men and make...",I,"Lisa's comment, Minne's behavior, someone definfing kenyan men",3,,The author feels the comments were racist,I,Polygamy for men,Polygamy for men,3,2,2,3,I,Race,3,0,,"3,4",3,0,,0,,0,,0,,0,,0,,0,,,,,,,,,
1.91E+18,I know I’m a bit late to season 2 but it seems like some of these women in #rhonairobi don’t know they’ll get old too because the age shaming left right center…,I,The age shaming,3,,The age shaming by the women in the shows,0,,,,,,,0,,,0,,10,6,0,,0,,0,,0,,0,,0,,0,,,,,,,,,
1.84E+18,"Minne called Sonal a high end escort on a reality show and thinks an apology will cut it😂😂😂Smh. Also, Dr C is giving bitch vibes🤮

#RHoNairobi",,,,,,,,,,,,,,,,,,,,,,,,,,,,,,,,,,,,,,,,,
1.83E+18,Fareed always cuts Zena off and allows others to do the same. So her message is never completely put out there. #RHONairobi #RHONairobiReunion https://t.co/yLV5kpD3Ip,,,,,,,,,,,,,,,,,,,,,,,,,,,,,,,,,,,,,,,,,
1.83E+18,Honestly the show made the franchise feel like an investigation. Real housewives is all about empowering women and celebrating successful woman not this kidnapping stories #RHONairobi,,,,,,,,,,,,,,,,,,,,,,,,,,,,,,,,,,,,,,,,,
1.83E+18,"Looks wise-

Minne - everything looked good 
Zena- although it's a predictable look,but it was well put together 
 Farah- nice idea,but someone was out of place 
Vera- looked uncomfortable but okay
Dr C - no comment, at least she's stuck to the theme

#RHONairobi",,,,,,,,,,,,,,,,,,,,,,,,,,,,,,,,,,,,,,,,,
1.83E+18,"Let's give it up for Kirinyash Women Rep Wakili Njeri Maina.
Top of the list.
Top of the range.
Top of them all.

PR aside.

#RHONairobi
#MasculinitySaturday
RUTOMUSTGO
QuickMart Njeri Maina Gacheri University of Nairobi Khaligraph Jones Irungu Nyakera SHIF Maasai Oparanya https://t.co/iFUrO4UlPT",,,,,,,,,,,,,,,,,,,,,,,,,,,,,,,,,,,,,,,,,
1.83E+18,Ni ushoga tuu ndio ako nayo ..ata ni vizuri amezaa boys only coz angezaa girl child huyu angemkill ...he hates women sana,,,,,,,,,,,,,,,,,,,,,,,,,,,,,,,,,,,,,,,,,
1.83E+18,"@nini_seekane No these women planned to gang up against her! Just like they did Sonal last season! She's been called a murderer, a witch, a prostitute! She had no option but to defend herself! #RHONairobi",,,,,,,,,,,,,,,,,,,,,,,,,,,,,,,,,,,,,,,,,
1.83E+18,This season was literally all about forming alliances and hanging up on someone 🙄no storyline whatsoever very boring and childish season even the reunion oldage women screaming at each other 🙄#RHONairobi,,,,,,,,,,,,,,,,,,,,,,,,,,,,,,,,,,,,,,,,,
1.82E+18,"Last season Minne shown throughout the season, we loved her. But this season we realized she’s actually a mean girl and it was pretentious of her to say she supports women while all along she has been body shaming the ladies, casually throwing racism and ageism there #RHONairobi",,,,,,,,,,,,,,,,,,,,,,,,,,,,,,,,,,,,,,,,,
1.82E+18,"Charles is the first husband to be invited to the reunion on any African real housewives franchise , I stand to be corrected though but listen this man supports his wife hey 🔥🔥🔥🔥 #RHONairobi",,,,,,,,,,,,,,,,,,,,,,,,,,,,,,,,,,,,,,,,,
1.82E+18,Minne came with her rehearsed PR trained apology. You do not support women! I could never support women and even dream about uttering half of the things you did #RHONairobi,,,,,,,,,,,,,,,,,,,,,,,,,,,,,,,,,,,,,,,,,
1.82E+18,Minne saying she's pro women &amp; supports women is the biggest load of crap she's spewed all season. That apology is not from remorse. It's from trying to keep her social media followers. #RHONairobi,,,,,,,,,,,,,,,,,,,,,,,,,,,,,,,,,,,,,,,,,
1.82E+18,Grown women arguing on TV about who owns what and who lives how/where is very very yuck! Haiiii! Kumbe appearances hii town ni kazi kubwa hivi... 😭😭😭 #RHONairobi,,,,,,,,,,,,,,,,,,,,,,,,,,,,,,,,,,,,,,,,,
1.82E+18,The tension between Minnie and Zena is so thick! You can’t even cut it with a knife 😂 #RHONairobi,,,,,,,,,,,,,,,,,,,,,,,,,,,,,,,,,,,,,,,,,
1.82E+18,Do you guys see why I say that Dr. C is the best housewife on this show?? The way she brought out that Pandora's box with all the documents just to prove her point. That’s how a housewife behaves #RHONairobi,,,,,,,,,,,,,,,,,,,,,,,,,,,,,,,,,,,,,,,,,
1.82E+18,Ummmmm I don't know about Fareed hosting skills on #RHONairobi reunion 😬😬 it's not giving what it's supposed to ! And he's literally struggling to control the narrative and these women ..,,,,,,,,,,,,,,,,,,,,,,,,,,,,,,,,,,,,,,,,,
1.82E+18,Zenah was baptised by fire in the wrong way. You don't get into a show and immediately find an alliance. These girls switch very fast. As a newbie you're better off fence sitting and watching a stronger side. #RHONairobi,,,,,,,,,,,,,,,,,,,,,,,,,,,,,,,,,,,,,,,,,
1.82E+18,"Boity must NOT want to get married because there is no way, men are not asking. This woman is drop dead gorgeous. WHAT. Who wouldn't want this as his wife? But let me read my books chile. You can join me by following the link below

#RHONairobi Buhle #AskAMan Nhlamulo Zulus Emtee https://t.co/lYP4xIZqlP",,,,,,,,,,,,,,,,,,,,,,,,,,,,,,,,,,,,,,,,,
1.82E+18,@ShowmaxOnline you guys are cutesy and definitely not demure 🤢#Rhonairobi https://t.co/FDq4sGNGT9,,,,,,,,,,,,,,,,,,,,,,,,,,,,,,,,,,,,,,,,,
1.82E+18,"The second reunion of #RHONairobi drops tomorrow. Kuna mtu anajua kumake entrance kama Vera? #RHON S2 #Housewives #Showmax 
https://t.co/yl9qpsz5Xa https://t.co/zIHsNVfguy",,,,,,,,,,,,,,,,,,,,,,,,,,,,,,,,,,,,,,,,,
1.82E+18,"Nobody is coming to save you. You have to wake yourself up. It is one moment in time you need to do that is going to define your destiny~ Dr.@catherinmasitsa 

Host: @CathMwangi
Producer: @alangomillicent 

#RHONairobi #WhatsYourStory #KTNWelcomeHome https://t.co/iqEBQQHY9b",,,,,,,,,,,,,,,,,,,,,,,,,,,,,,,,,,,,,,,,,
1.82E+18,Nikimalizana na serikali sasa real housewives of nairobi watatuambia why they platform bullies and people with bad wigs,,,,,,,,,,,,,,,,,,,,,,,,,,,,,,,,,,,,,,,,,
1.82E+18,"@Create-d6i   we've heard you... protector of the oppressed, omuwanika, madam parliament, Mrs. Boniface mwangi, Madam Eric omondi, muteti....kama anakaa fossil, ata umpake mafuta aje hatanona",,,,,,,,,,,,,,,,,,,,,,,,,,,,,,,,,,,,,,,,,
1.82E+18,"Such a flop..violent women, no class, forced drama plus not the real representation the ladies in Nairobi...I preffered the cast on Sn1. Dr.C is cool #RHONairobi #RealHouseWivesofNairobi",,,,,,,,,,,,,,,,,,,,,,,,,,,,,,,,,,,,,,,,,
1.99E+18,"Ronu made this possible. Even when most of the women under this thread threw them under the bus for their hypocritical non-Yoruba friends… even when they blocked them, saying they were “doing too much”… even with all the insults and slurs thrown at them, they still stood their ground and did what was right. The guilt will always be on you all.",,,,,,,,,,,,,,,,,,,,,,,,,,,,,,,,,,,,,,,,,
1.82E+18,"The other African Real Housewives show can cut from the #RHONairobi cloth. This week was the finale, and next week is part one of the reunion. Not this thing of having to wait at least 2 weeks for a reunion.",,,,,,,,,,,,,,,,,,,,,,,,,,,,,,,,,,,,,,,,,
1.82E+18,This thing of Farah always want to mediate yet they hate on her is sad… She needs to let these women be cause they never have her back when she’s in hot soup… #RHONairobi,,,,,,,,,,,,,,,,,,,,,,,,,,,,,,,,,,,,,,,,,
1.82E+18,I don’t understand why Zena actually went on that girl’s trip. Can she grow up honestly or like Rejah just go home. Some women just need to grow up because it’s giving jealous 6year old vibes #RHONairobi,,,,,,,,,,,,,,,,,,,,,,,,,,,,,,,,,,,,,,,,,
1.82E+18,"Minne, Dr C and Vera are such mean girls. Their sole mission is to get the new girls off the show so that they are seen as strong women who survived the show 🙄🙄 #RHONairobi",,,,,,,,,,,,,,,,,,,,,,,,,,,,,,,,,,,,,,,,,
1.82E+18,"@ShowmaxKenya Hio fala ilikua na pesa hapo 2019 karibu itukojolee juu sisi ni maskini... Nigga exchanges women on a regular, flaunting on a certain 2 seater area za kahawa.",,,,,,,,,,,,,,,,,,,,,,,,,,,,,,,,,,,,,,,,,
1.82E+18,"mimi and Dr C must go , they are not reality Queens , for 2 seasons and they are still doing same shit, can we have real women  #RHONairobi",,,,,,,,,,,,,,,,,,,,,,,,,,,,,,,,,,,,,,,,,
1.82E+18,"If we’re being honest, Dr. C is undoubtedly carrying the African real housewives franchise on her back. She’s a true housewife, she’s funny, delusional and knows how to provoke the girls and bring drama. She’s the true villain #RHONairobi",,,,,,,,,,,,,,,,,,,,,,,,,,,,,,,,,,,,,,,,,
1.82E+18,This wasn’t a good season compared to the first one. The girls lack class and self-control. Dr C had no choice but to single-handedly carry this show on her back. I don’t know a better housewife. I hope that they rethink their casting for the next season #RHONairobi,,,,,,,,,,,,,,,,,,,,,,,,,,,,,,,,,,,,,,,,,
1.82E+18,These women are behaving so badly. You can’t make being late part of your character like it’s a good thing. Some East Africans are well mannered but these one no #RHONairobi,,,,,,,,,,,,,,,,,,,,,,,,,,,,,,,,,,,,,,,,,
1.81E+18,"Rejah is so pretty, had hope for her as a housewife💀 but from the get go she seemed so lost in this group &amp; looked distressed.
She never even mentioned that she's married👀.
Now with the husband suing the show clearly things ain't right at home...
#RHONairobi",,,,,,,,,,,,,,,,,,,,,,,,,,,,,,,,,,,,,,,,,
1.81E+18,Honestly Dr. C is deliberately antagonizing these women to get a reaction…and it is so sick &amp; disgusting 🤮 And then Minne…a very pathetic friend tbh #RHONairobi https://t.co/BKygEHyRUP,,,,,,,,,,,,,,,,,,,,,,,,,,,,,,,,,,,,,,,,,
1.81E+18,"Looks like Rejah just came with a lot of drama. Her husband is suing her &amp; the show as she filmed in his house with their kids without his consent. To his knowledge, she withdrew from the show after surgery only to find out she continued to film without his consent 🙆🏽‍♀️#RHONairobi https://t.co/jXHGNdYkky",,,,,,,,,,,,,,,,,,,,,,,,,,,,,,,,,,,,,,,,,
1.81E+18,Dr C seems like a powerful and influential someone in Nairobi. She has contacts and plugs people. I suspect that’s why Minnie and Vera will keep fighting or gossiping about her but never ever cut ties with her. They never burn the bridge #RHONairobi,,,,,,,,,,,,,,,,,,,,,,,,,,,,,,,,,,,,,,,,,
1.81E+18,These women all bluetoothed their hate for Dr C. I’m trying hard to think of what Dr C did to Rajah before the sniffing comments?? Child soldier comments are not that deep. She should have clarified and moved on .. #RHONairobi,,,,,,,,,,,,,,,,,,,,,,,,,,,,,,,,,,,,,,,,,
1.81E+18,"Zena takes everything Dr C says to heart. Shame, she's not cut out for this group. She should have fun with the drama #RHONairobi",,,,,,,,,,,,,,,,,,,,,,,,,,,,,,,,,,,,,,,,,
1.81E+18,"It is really not safe here , poor Farah is cut now #RHONairobi",,,,,,,,,,,,,,,,,,,,,,,,,,,,,,,,,,,,,,,,,
1.81E+18,Minne had no problem with the cultural implications of Zena bringing Dr.C a gifts that portrayed her as a witch but Dr.C is wishing Zena death with that coffin? Cut the bs and double standards! #RHONairobi,,,,,,,,,,,,,,,,,,,,,,,,,,,,,,,,,,,,,,,,,
1.81E+18,"Farah and Xenah's yellows looks are super cute. 

#RHONairobi",,,,,,,,,,,,,,,,,,,,,,,,,,,,,,,,,,,,,,,,,
1.81E+18,"Gathoni ni cucu utonaga mbele, amepewa pesa na Kasongo Maringo ikamshika , we are waiting her to take that young man to court, if she is woman enough let her do it, Shame on her.",,,,,,,,,,,,,,,,,,,,,,,,,,,,,,,,,,,,,,,,,
1.81E+18,"But Dr C knows how Rejah reacts so she can't act surprised that this happened.

Minnie shut it, you threw water and tissue and women.

Vera stop it's not just the new ladies.

#RHONairobi",,,,,,,,,,,,,,,,,,,,,,,,,,,,,,,,,,,,,,,,,
1.81E+18,"🤣🤣 Dr C how is it a character assassination?

Also Dr C she accepted your misinterpretation why can't you accept hers?

Also I mean doesn't Vera sell her nyash and don't you hook up women Dr C?

Dr C is definitely lying now.

#RHONairobi",,,,,,,,,,,,,,,,,,,,,,,,,,,,,,,,,,,,,,,,,
1.81E+18,"Cute are those stainless steel water bottles customised?

Driving this far after landing is criminal.

#RHONairobi",,,,,,,,,,,,,,,,,,,,,,,,,,,,,,,,,,,,,,,,,
1.81E+18,"Dr C said I wanna see the call logs and now these women are pretending to love each other.

Minnie doesn't trust the lady who's been in her house and around her husband?

#RHONairobi",,,,,,,,,,,,,,,,,,,,,,,,,,,,,,,,,,,,,,,,,
1.81E+18,The conversation Minnie and Dr C had was really good. She held Dr c accountable and she is not siding with violent women. I still think she didn’t want Dr C to spill anything else about Charles #Rhonairobi,,,,,,,,,,,,,,,,,,,,,,,,,,,,,,,,,,,,,,,,,
1.81E+18,I think Xena only has this energy towards Dr C because the other women also don’t like her. I don’t think she’d be this brave if it was just her and Dr C beefing #RHONairobi,,,,,,,,,,,,,,,,,,,,,,,,,,,,,,,,,,,,,,,,,
1.81E+18,"Hhayi guys! The amount of dilulu in Minne is concerning. She actually things she's the prettiest flower in the garden, that's why she thinks it's ok to bash Farrah's face. Even Miss Universe would not have that right speak this way about other women. #RHONairobi",,,,,,,,,,,,,,,,,,,,,,,,,,,,,,,,,,,,,,,,,
1.81E+18,"Zena, Vera and Minne are terrible women. Farrah doesn’t deserve to be treated that. The biggest bullies of note. Get them off my fucking screen. Such ghetto ass behaviour 🙄 #RHONairobi https://t.co/29AHmlqYrq",,,,,,,,,,,,,,,,,,,,,,,,,,,,,,,,,,,,,,,,,
1.81E+18,"Hate watching #RHONairobi 
Dr. C should be slapped for that murder accusation. 
The casting director should bring us rich non working class women, i’m tired of seeing imenti fashion and fake brands on my tv. 
Hatutaki hustlers😭",,,,,,,,,,,,,,,,,,,,,,,,,,,,,,,,,,,,,,,,,
1.81E+18,"Why do all these crazy women always have to throw things at Dr C??? They all say mean things to each other. Why can't you speak like adults?
#RHONairobi",,,,,,,,,,,,,,,,,,,,,,,,,,,,,,,,,,,,,,,,,
1.81E+18,"I get women shading each other with class but throwing things at each other, flipping a whole table , shame ! Minnie using the fact that she is pregnant to disrespect people, The bar is beyond low . #RHON #RHONairobi",,,,,,,,,,,,,,,,,,,,,,,,,,,,,,,,,,,,,,,,,
1.81E+18,"I just finished watching #RHONairobi  And what’s that damn , they need to bring us more classy women in the show .They must fire zena and Rejah mentally they are not prepared and they lack class for real .",,,,,,,,,,,,,,,,,,,,,,,,,,,,,,,,,,,,,,,,,
1.81E+18,Funny how she is always a part of the casualties of her acquaintances. When they want to fxck up their supposed enemies she is always there being sprayed with wine or almost being cut. 🤣🤣🤣 #RHONairobi,,,,,,,,,,,,,,,,,,,,,,,,,,,,,,,,,,,,,,,,,
1.81E+18,"Minne, Zena and Vera are mean and vile women, we don’t need them on our screens anymore. I’ve lost the like I had for Minne from season 1. Disgusting behaviour!!  #RHONairobi",,,,,,,,,,,,,,,,,,,,,,,,,,,,,,,,,,,,,,,,,
1.81E+18,Okay so do we all catch these racist comments Minne keeps making about Dr. C's husband...remind me why y'all hyped this woman up in Season 1?!!!  #RHONairobi,,,,,,,,,,,,,,,,,,,,,,,,,,,,,,,,,,,,,,,,,
1.81E+18,"@iAmWayneSam @ShowmaxKenya What did they carry??Being unhinged every episode?💀 Zena has been angry &amp; bitter EVERY EPISODE,the only time she’s happy is around Minnie’s husband lmao. Reja has serious mental issues &amp; it’s painful to witness on screen. They need Baddies West NOT #RHONairobi @ShowmaxKenya",,,,,,,,,,,,,,,,,,,,,,,,,,,,,,,,,,,,,,,,,
1.81E+18,"Negativity or prioritizing wealth and fame over others well being is what defines a ""nobody"". Whether it's the privileged who perpetuate harmful systems or the poor who justify resentment towards those who have more, the result is the same #rhonairobi. https://t.co/EX8TM7zzAU",,,,,,,,,,,,,,,,,,,,,,,,,,,,,,,,,,,,,,,,,
1.81E+18,.@ShowmaxKenya @ShowmaxOnline Honestly there is nothing cute about seeing grown women fight or get physical and production fails to address it!!! The show is beyond vile and toxic! The 4 girls ARE BULLIES…#RHONairobi @Rhonairobiquote,,,,,,,,,,,,,,,,,,,,,,,,,,,,,,,,,,,,,,,,,
1.81E+18,"#RHONairobi This Show lost it when they brought a fake nyash Whore, Child  kidnapper/killer, and that mentally disturbed soldier to the show. We want real Housewives, not these things abeg https://t.co/iC3EY4V3pD",,,,,,,,,,,,,,,,,,,,,,,,,,,,,,,,,,,,,,,,,
1.81E+18,"These women have no shame ….. mnxxxxx  Minnie, Vera and Zena ….. I have lost my understanding of what shady means. No 👸🏽 today just villains 🤮 …. Shooooo coffins ⚰️ broken glass everywhere …. Just hysteria and ratchetness 🚮 #RHONairobi",,,,,,,,,,,,,,,,,,,,,,,,,,,,,,,,,,,,,,,,,
1.81E+18,"Can someone start a petition for us we don't want Zena and Minne on our screens next season . @ShowmaxOnline @ShowmaxKenya do something those violent women don't deserve our time. 

Other long live the Queen Dr C

#RHONairobi",,,,,,,,,,,,,,,,,,,,,,,,,,,,,,,,,,,,,,,,,
1.81E+18,"@ShowmaxKenya I don't think any one of us appreciated the disrespect at the event. There is a thin line between entertainment &amp; ugly behaviour. How uncouth. 
Center the show around Dr C, Lisa and her friends. We want opulent fun lives, not social media slay queens.
#RHONairobi",,,,,,,,,,,,,,,,,,,,,,,,,,,,,,,,,,,,,,,,,
1.81E+18,"Minne is a clown ! That make is horrible and is her husband a housewife now? Her husbands cheap American accent, irks me out 😭. #RHONairobi",,,,,,,,,,,,,,,,,,,,,,,,,,,,,,,,,,,,,,,,,
1.81E+18,"I hate how Vera pretends to like Dr C but talk badly about her when she is with those evil women, i mean she put you on and you shade like this. Poor Farah her beautiful event ruined by a mad, classless woman who cant control her emotions. Zena is ratchet not a lady. #RHONairobi",,,,,,,,,,,,,,,,,,,,,,,,,,,,,,,,,,,,,,,,,
1.81E+18,"Production needs to Gove Dr. C her flowers. She's the show and the show is her. Without her, all these other women would give absolutely nothing.
#RHONairobi",,,,,,,,,,,,,,,,,,,,,,,,,,,,,,,,,,,,,,,,,
1.81E+18,I don’t know who told these women that displaying how angry they can get will earn them respect… because it’s all just lack of self control. #RHONairobi https://t.co/VHS192QupH,,,,,,,,,,,,,,,,,,,,,,,,,,,,,,,,,,,,,,,,,
1.81E+18,"Fuck Zena for the disrespect to Farah, Fuck Vera for being double sided , fuck Minne for racial comments to Dr C’s husband and Farah! #RHONairobi",,,,,,,,,,,,,,,,,,,,,,,,,,,,,,,,,,,,,,,,,
1.81E+18,"Dr C confidently tells off Zena that the women she has allegedly been killing will get buried in the casket she gifted her. 😂😂
#RHONairobi",,,,,,,,,,,,,,,,,,,,,,,,,,,,,,,,,,,,,,,,,
1.81E+18,"@ShowmaxKenya
These violent women should be taken out of the cast.

Zena, Minne &amp; Rejah must not return next season.

Attacking people physically over the slightest things is not what civilized people do.

The other ladies do not need to feel threatened on this show.

#RHONairobi",,,,,,,,,,,,,,,,,,,,,,,,,,,,,,,,,,,,,,,,,
1.81E+18,"Minnie is racist AF. The dairy comments she makes about Dr C husband, while she wants no one to talk about her husband. And very hands on for a pregnant woman throwing things at Dr C &amp; if tables were to be turned... Ho ho ho ho
#RHONairobi https://t.co/YVPnUs09mZ",,,,,,,,,,,,,,,,,,,,,,,,,,,,,,,,,,,,,,,,,
1.81E+18,"These women really think that this is what Real Housewives is about? The alliances, planning take downs behind the scenes, accusations about real life crimes, bullying?? #RHONairobi https://t.co/K5w9He8m61",,,,,,,,,,,,,,,,,,,,,,,,,,,,,,,,,,,,,,,,,
1.81E+18,I don’t think Dr C meant that she killed literally 😭 but yay it struck a nerve so something is up . It’s really a mafia world because she’s kidnapped kids and now killed women ? #RHONairobi https://t.co/P8euW46ibL,,,,,,,,,,,,,,,,,,,,,,,,,,,,,,,,,,,,,,,,,
1.81E+18,Like this is not housewives vibes. Apart from Dr C… this is REAL GHETTO WOMEN SHOW…. No iota of class among the lots aside Farah and Dr C…. Jeeezzz am I dreaming?  #RHONairobi,,,,,,,,,,,,,,,,,,,,,,,,,,,,,,,,,,,,,,,,,
1.81E+18,Yooooo… this show is evil…. Get Zena and Rejah out of here. These women are ticking time bomb and belong to the mental home… #RHONairobi,,,,,,,,,,,,,,,,,,,,,,,,,,,,,,,,,,,,,,,,,
1.81E+18,"Charles was weirded out that his wife has a wife called Xenah , now he is mentoring her kids and being the father figure? 😭 #rhonairobi https://t.co/3bpxmJF1Nc",,,,,,,,,,,,,,,,,,,,,,,,,,,,,,,,,,,,,,,,,
1.81E+18,"I’m not sure I appreciate how Dr. C riles up these women, takes them to the bottomest ghetto and then pats herself on the back for all the chaos she’s caused. She enjoys it. They need to stop giving it to her 😬#RHONairobi",,,,,,,,,,,,,,,,,,,,,,,,,,,,,,,,,,,,,,,,,
